{
  "schema_version": 1,
  "source": "https://platform.claude.com/docs/en/models/overview",
  "default_model": "claude-sonnet-5",
  "models": [
    {
      "id": "claude-opus-5-5",
      "name": "Claude Opus 5.5",
      "minimum_client_version": "2.1.280",
      "capabilities": ["text", "image", "pdf"],
      "shipped_default_effort": "medium"
    },
    {
      "id": "claude-sonnet-5-5",
      "name": "Claude Sonnet 5.5",
      "minimum_client_version": "2.1.284",
      "capabilities": ["text", "image", "pdf"],
      "shipped_default_effort": "medium"
    },
    {
      "id": "claude-haiku-5-5",
      "name": "Claude Haiku 5.5",
      "minimum_client_version": "2.1.293",
      "capabilities": ["text", "image", "pdf"],
      "shipped_default_effort": "medium"
    },
    {
      "id": "claude-fable-5-1",
      "name": "Claude Fable 5.1",
      "capabilities": ["text", "image", "pdf"]
    },
    {
      "id": "claude-sonnet-5",
      "name": "Claude Sonnet 5",
      "capabilities": ["text", "image", "pdf"],
      "shipped_default_effort": "low"
    },
    {
      "id": "claude-haiku-4-5-20251001",
      "name": "Claude Haiku 4.5",
      "capabilities": ["text", "image", "pdf"],
      "shipped_default_effort": "low"
    }
  ]
}
